### ISSUE TITLE
Visualizer display is completely white while try to adapt with our own camera

### ISSUE THREAD

**Issue by Deniel-L** [nvidia-holoscan/holoscan-sensor-bridge#25]
**Hardware env:**
- Jetson Agx Orin Devkit (with Jetpack6.2)
- Holoscan Bridge Board (Lattice CPNX100-ETH-SENSOR-BRIDGE)
- Customer GMSL adapt board (connect to the camera connector of the HSB)
- Our own GMSL camera (raw sensor with GMSL serializer, 1920x1200@30fps raw10 format)

![Image](https://github.com/user-attachments/assets/138c5f29-dff0-4c9c-b560-324b9cdd4542)

**Problem Description**
-  We have correct GMSL serdes register setting and sensor setting, because we can successfully bringup this camera when letting the GMSL adapt board connect directly to Jetson Agx Orin Devkit
- We try to adapt this GMSL camera to HSB reference the guid at link https://docs.nvidia.com/holoscan/sensor-bridge/latest/index.html
- But when we try to lightup it, the Visualizer display is completely white
- We dumped the data and find that the data seems always 0x00

![Image](https://github.com/user-attachments/assets/269aa914-6530-4344-887c-2d6b3b7722a9)

![Image](https://github.com/user-attachments/assets/53d9a555-35f6-425c-ac06-4ab577ad17d6)

**Question**

1. What reason cause the Visualizer display is completely white ?
2. Does the new camera adapt need to modify the firmware of FPGA on the HSB ? Or new camera adapt only need to modify the software in this repo ?
3. Can you provide some troubleshooting suggestions for the issue we are currently facing?

Thanks.

**Comment by p-ogrady** [comment]
Thanks for your questions.
- In the AGX configuration, the video buffer is filled with 0xFF, then that content is replaced with image data as it is received.  If the receiver drops packets--typically due to bandwidth oversubscription-- then you'll see white streaks on the display, where each streak shows where visual data was lost.  If the display is entirely white, then it suggests that all of the video data was lost. 
- I wouldn't expect that a specific camera would require FPGA changes; the FPGA IP block is camera agnostic and any differences in camera configuration and data handling should be entirely in the host.

For troubleshooting advice: your trace data shows a sequence of a 1482 byte packet followed by a 206 byte packet; this pair arrives with at least .1 seconds between each image.  A normal video frame would be many 1482 byte packets with a shorter video packet last (with the remainder of the data).  If the data frame size wasn't correctly configured, it could produce the sequence you're seeing.  When I run the IMX274 video player in 1080p mode, I see this message on the console:
```
...
INFO 5257 start base_receiver_op.py:71 tid=Dummy-1 -- frame_size=10419600 frame=281472281870336
INFO data_channel.cpp:300 configure_socket tid=0xa0 -- (done) DataChannel configure_socket socket_fd=39 local_ip=192.168.0.101.
INFO 5260 start base_receiver_op.py:76 tid=Dummy-1 -- local_ip='192.168.0.101' local_port=60132
INFO data_channel.cpp:129 compute_payload_size tid=0xa0 -- header_size=78 payload_size=1408 packets=7401
...
```
Verify that your frame_size value is as expected for the data in a single video frame.  The `packets` value, in the last log line, is based on that `frame_size` value.  If the numbers you see on the console are as expected, please post your console output with these logging messages included.

**Comment by Deniel-L** [comment]
- I can't understand how the frame_size is calculated. I've tried to calculate it based on the resolution of the image, but it just doesn't match up. Could you please tell me how it's calculated? 

- In addition, I will send out my console logs as follows. Please help to check what the problem is. 
    <frozen importlib._bootstrap_external>:1184: FutureWarning: The cuda.cuda module is deprecated and will be removed in a future release, please switch to use the cuda.bindings.driver module instead.
    INFO 182 main linux_ar0234_player.py:198 tid=MainThread -- Initializing.
    INFO 993 __init__ linux_ar0234_player.py:41 tid=MainThread -- __init__
    INFO hololink.cpp:202 start tid=0x87 -- FPGA version=0x2412 datecode=0xc5e6cc11
    INFO hololink.cpp:258 reset tid=0x87 -- version=0x2412
    INFO 2208 configure ar0234.py:68 tid=MainThread -- version=1
    [info] [fragment.cpp:588] Loading extensions from configs...
    [info] [gxf_executor.cpp:262] Creating context
    INFO 2224 compose linux_ar0234_player.py:53 tid=MainThread -- compose
    INFO 2599 setup base_receiver_op.py:58 tid=MainThread -- setup
    [info] [gxf_executor.cpp:1764] creating input IOSpec named 'input'
    [info] [gxf_executor.cpp:1764] creating input IOSpec named 'input'
    [info] [gxf_executor.cpp:1764] creating input IOSpec named 'receiver'
    [info] [gxf_executor.cpp:1764] creating input IOSpec named 'receivers:0'
    [info] [gxf_executor.cpp:1764] creating input IOSpec named 'render_buffer_input'
    [info] [gxf_executor.cpp:1764] creating input IOSpec named 'camera_up_input'
    [info] [gxf_executor.cpp:1764] creating input IOSpec named 'camera_look_at_input'
    [info] [gxf_executor.cpp:1764] creating input IOSpec named 'camera_eye_input'
    [info] [gxf_executor.cpp:1764] creating input IOSpec named 'input_specs'
    [info] [gxf_executor.cpp:1764] creating input IOSpec named 'receivers'
    [info] [gxf_executor.cpp:2171] Activating Graph...
    [info] [gxf_executor.cpp:2201] Running Graph...
    [info] [gxf_executor.cpp:2203] Waiting for completion...
    [info] [greedy_scheduler.cpp:191] Scheduling 5 entities
    INFO 2802 start base_receiver_op.py:71 tid=Dummy-1 -- frame_size=2887208 frame=8681451520
    INFO data_channel.cpp:300 configure_socket tid=0x96 -- (done) DataChannel configure_socket socket_fd=42 local_ip=192.168.0.101.
    INFO 2806 start base_receiver_op.py:76 tid=Dummy-1 -- local_ip='192.168.0.101' local_port=55269
    INFO data_channel.cpp:129 compute_payload_size tid=0x96 -- header_size=78 payload_size=1408 packets=2051
    error: XDG_RUNTIME_DIR not set in the environment.
    [info] [context.cpp:52] _______________
    [info] [context.cpp:52] Vulkan Version:
    [info] [context.cpp:52]  - available:  1.3.204
    [info] [context.cpp:52]  - requesting: 1.2.0
    [info] [context.cpp:52] ______________________
    [info] [context.cpp:52] Used Instance Layers :
    [info] [context.cpp:52] 
    [info] [context.cpp:52] Used Instance Extensions :
    [info] [context.cpp:52] VK_KHR_surface
    [info] [context.cpp:52] VK_KHR_xcb_surface
    [info] [context.cpp:52] VK_EXT_debug_utils
    [info] [context.cpp:52] VK_KHR_external_memory_capabilities
    [info] [context.cpp:52] ____________________
    [info] [context.cpp:52] Compatible Devices :
    [info] [context.cpp:52] 0: NVIDIA Tegra Orin (nvgpu)
    [info] [context.cpp:52] Physical devices found : 
    [info] [context.cpp:52] 1
    [info] [context.cpp:52] ________________________
    [info] [context.cpp:52] Used Device Extensions :
    [info] [context.cpp:52] VK_KHR_swapchain
    [info] [context.cpp:52] VK_KHR_external_memory
    [info] [context.cpp:52] VK_KHR_external_memory_fd
    [info] [context.cpp:52] VK_KHR_external_semaphore
    [info] [context.cpp:52] VK_KHR_external_semaphore_fd
    [info] [context.cpp:52] VK_KHR_push_descriptor
    [info] [context.cpp:52] VK_EXT_line_rasterization
    [info] [context.cpp:52] VK_KHR_sampler_ycbcr_conversion
    [info] [context.cpp:52] 
    [info] [vulkan_app.cpp:405] Using device 0: NVIDIA Tegra Orin (nvgpu) (UUID a527bc5783e5bccb73e6c77d2b3e15)
    [info] [framebuffer_sequence.cpp:128] Using surface format 'B8G8R8A8Unorm, SrgbNonlinear'
    [info] [framebuffer_sequence.cpp:148] Using depth format 'D32Sfloat'
    [info] [framebuffer_sequence.cpp:277] Using present mode 'Immediate'
    [info] [framebuffer_sequence.cpp:128] Using surface format 'B8G8R8A8Srgb, SrgbNonlinear'
    [info] [framebuffer_sequence.cpp:148] Using depth format 'D32Sfloat'
    [info] [framebuffer_sequence.cpp:277] Using present mode 'Immediate'
    [warning] [cuda_stream_handler.cpp:231] Parameter `cuda_stream_pool` is not set, using the default CUDA stream for CUDA operations.
    [warning] [cuda_stream_handler.cpp:231] Parameter `cuda_stream_pool` is not set, using the default CUDA stream for CUDA operations.
    [warning] [cuda_stream_handler.cpp:231] Parameter `cuda_stream_pool` is not set, using the default CUDA stream for CUDA operations.
    [warning] [cuda_stream_handler.cpp:231] Parameter `cuda_stream_pool` is not set, using the default CUDA stream for CUDA operations.
    [info] [framebuffer_sequence.cpp:277] Using present mode 'Immediate'
    [info] [holoviz.cpp:2168] Input spec:
    - type: color
      name: ""
      opacity: 1.000000
      priority: 0
      image_format: r16g16b16a16_unorm

- tcpdump log is as follow
    09:39:52.026448 IP truncated-ip - 1400 bytes missing! 192.168.0.2.12288 > nvidia-desktop.55269: UDP, length 1440
    09:39:52.026449 IP 192.168.0.2.12288 > nvidia-desktop.55269: UDP, length 164
    09:39:58.017305 IP truncated-ip - 1400 bytes missing! 192.168.0.2.12288 > nvidia-desktop.55269: UDP, length 1440
    09:39:58.017307 IP 192.168.0.2.12288 > nvidia-desktop.55269: UDP, length 164
    09:40:04.008164 IP truncated-ip - 1400 bytes missing! 192.168.0.2.12288 > nvidia-desktop.55269: UDP, length 1440
    09:40:04.008165 IP 192.168.0.2.12288 > nvidia-desktop.55269: UDP, length 164
    09:40:09.998504 IP truncated-ip - 1400 bytes missing! 192.168.0.2.12288 > nvidia-desktop.55269: UDP, length 1440
    09:40:09.998505 IP 192.168.0.2.12288 > nvidia-desktop.55269: UDP, length 164
    09:40:15.989870 IP truncated-ip - 1400 bytes missing! 192.168.0.2.12288 > nvidia-desktop.55269: UDP, length 1440
    09:40:15.989871 IP 192.168.0.2.12288 > nvidia-desktop.55269: UDP, length 164
    09:40:21.980735 IP truncated-ip - 1400 bytes missing! 192.168.0.2.12288 > nvidia-desktop.55269: UDP, length 1440
    09:40:21.980736 IP 192.168.0.2.12288 > nvidia-desktop.55269: UDP, length 164

**Comment by wjohn-nvidia** [comment]
Hi Deniel,

If you are getting all white screen, another possibility is the camera driver is incorrect. 

- how many mipi lanes do you expect? What's the rate per mipi lane?
- can you validate the sensor is configured with the correct values by reading back from the sensor registers?
- can you share driver script?
- what is the frame_size (number of bytes per frame) you are setting?  from the log, it seems to be alternating between 1440 and 164, which is not normal as a complete frame should have a series of 1440 byte pixel packets followed by a smaller end of frame metadata packet. Can you capture a PCAP file and share with us?

Regards,
John

**Comment by Deniel-L** [comment]
- The register configurations of the GMSL adapter board and the sensor should are correct, because I can light up this camera on Agx Orin Devkit without HSB
- The rate per mipi lane is 1.5Gbps/lane, and mipi lanes is 4
- The frame_size should be calculated by Hololink based on the resolution set in the driver and the image format. My image resolution is 1920x1200, in RAW10 format, with a frame rate of 30fps.

**Comment by Deniel-L** [comment]
- I have validate the sensor is configured with the correct values by reading back from the sensor registers

**Comment by Deniel-L** [comment]
[source.zip](https://github.com/user-attachments/files/20187423/source.zip)

**Comment by Deniel-L** [comment]
[source.zip](https://github.com/user-attachments/files/20187424/source.zip)    

- I upload the driver source, Please help confirm whether there are any issues with the parts other than the register configuration.

**Comment by Deniel-L** [comment]
[driver and log.zip](https://github.com/user-attachments/files/20187537/driver.and.log.zip)

- I upload the driver source, Please help confirm whether there are any issues with the parts other than the register configuration.

**Comment by wjohn-nvidia** [comment]
Hi Deniel,

Just realized there's a parallel thread in the our nvbug. Do you mind if we continue this conversation inside the nvbug so we don't have posts and answers scattered in different places?

Regards,
John

**Comment by simonzhu10** [comment]
Hi Deniel,
We have holoscan driver for many cameras. You can contact us (support@leopardimaging.com) for more details.
